symbol,strategy,direction,signal_date,status,expiration,target_type,atr_target,entry_price,target_price,stop_price,last_close_price,diff_from_entry,entry_date,exit_date,num_days_open
XLB,Weekly 10.5 Squeeze Buy,buy,01/17/25,Target Hit,03/21/25,Weekly ATR5 x 0.55,0.6986,44.58,45.28,Expired,43.535,-1.0450000000000017,2025-01-17,2025-02-14,19
XLE,Weekly 10.5 Squeeze Buy,buy,01/17/25,Expired,03/21/25,Weekly ATR5 x 0.55,0.7692,46.86,47.63,Expired,45.44,-1.4200000000000017,2025-01-17,2025-03-21,43
QQQ,Weekly Turbo Hook Buy,buy,01/17/25,Target Hit,03/21/25,Weekly ATR5 x 0.55,9.6983,524.48,534.18,Expired,622.48,98.0,2025-01-17,2025-02-13,18
XLK,Donchian T-Lines Buy/Sell,buy,01/22/25,Expired,03/21/25,ATR5 x 1.0,2.3348,119.765,122.1,Expired,147.16,27.394999999999996,2025-01-22,2025-03-21,41
QQQ,Donchian Hook Buy,buy,01/22/25,Target Hit,03/21/25,ATR5 x 1.0,8.9263,529.04,537.97,Expired,622.48,93.44000000000005,2025-01-22,2025-02-14,17
XLK,Donchian Hook Buy,buy,01/22/25,Expired,03/21/25,ATR5 x 1.0,2.3348,119.765,122.1,Expired,147.16,27.394999999999996,2025-01-22,2025-03-21,41
IBB,Weekly 10.5 Squeeze Buy,buy,01/24/25,Target Hit,03/21/25,Weekly ATR5 x 0.55,2.0425,137.26,139.3,Expired,170.04,32.78,2025-01-24,2025-01-27,1
EWG,Weekly Swing Trend Buy,buy,01/24/25,Target Hit,03/21/25,Weekly ATR5 x 0.55,0.472,34.37,34.84,Expired,41.335,6.965000000000003,2025-01-27,2025-01-30,3
UNG,Weekly Ichimoku Squeeze Sell,sell,01/27/25,Expired,03/21/25,ATR20 x 1.0,0.9591,16.59,15.63,Expired,15.155,1.4350000000000005,2025-01-27,2025-03-21,38
USO,Weekly Ichimoku Squeeze Sell,sell,01/27/25,Target Hit,03/21/25,ATR20 x 1.0,1.3212,78.87,77.55,Expired,70.405,8.465000000000003,2025-01-27,2025-01-29,2
QQQ,Squeeze Play Sector Buy,buy,01/28/25,Target Hit,03/21/25,ATR5 x 1.0,10.1803,522.46,532.64,Expired,622.48,100.01999999999998,2025-01-28,2025-02-13,12
SPY,Squeeze Play Sector Buy,buy,01/28/25,Target Hit,03/21/25,ATR5 x 1.0,7.5137,603.72,611.23,Expired,682.55,78.82999999999993,2025-01-28,2025-02-18,14
XLK,Squeeze Play Sector Buy,buy,01/28/25,Target Hit,03/21/25,ATR5 x 1.0,3.2008,116.59,119.79,Expired,147.16,30.569999999999993,2025-01-28,2025-02-14,13
QQQ,Gap and Go Put/Call Buy (Setup 6),buy,01/28/25,Target Hit,03/21/25,ATR5 x 1.0,10.1803,522.46,532.64,Expired,622.48,100.01999999999998,2025-01-28,2025-02-13,12
SPY,Gap and Go Put/Call Buy (Setup 6),buy,01/28/25,Target Hit,03/21/25,ATR5 x 1.0,7.5137,603.72,611.23,Expired,682.55,78.82999999999993,2025-01-28,2025-02-18,14
XLK,Gap and Go Put/Call Buy (Setup 6),buy,01/28/25,Target Hit,03/21/25,ATR5 x 1.0,3.2008,116.59,119.79,Expired,147.16,30.569999999999993,2025-01-28,2025-02-14,13
GDX,Weekly 10.5 Squeeze Buy,buy,01/31/25,Target Hit,03/21/25,Weekly ATR5 x 0.55,0.9378,39.218,40.16,Expired,79.91,40.69199999999999,2025-01-31,2025-02-04,2
IYR,Weekly 10.5 Squeeze Buy,buy,01/31/25,Target Hit,03/21/25,Weekly ATR5 x 0.55,1.5125,93.83,95.34,Expired,94.859,1.0289999999999964,2025-02-03,2025-02-05,2
VNQ,Weekly 10.5 Squeeze Buy,buy,01/31/25,Target Hit,03/21/25,Weekly ATR5 x 0.55,1.4447,89.75,91.19,Expired,89.38,-0.37000000000000455,2025-02-03,2025-02-05,2
GDX,Weekly 10.5 Squeeze Buy,buy,01/31/25,Target Hit,03/21/25,Weekly ATR5 x 0.55,0.9378,39.218,40.16,Expired,79.91,40.69199999999999,2025-01-31,2025-02-04,2
IYR,Weekly 10.5 Squeeze Buy,buy,01/31/25,Target Hit,03/21/25,Weekly ATR5 x 0.55,1.5125,93.83,95.34,Expired,94.859,1.0289999999999964,2025-02-03,2025-02-05,2
VNQ,Weekly 10.5 Squeeze Buy,buy,01/31/25,Target Hit,03/21/25,Weekly ATR5 x 0.55,1.4447,89.75,91.19,Expired,89.38,-0.37000000000000455,2025-02-03,2025-02-05,2
XOP,Weekly Swing Sell,sell,01/31/25,Target Hit,03/21/25,Weekly ATR5 x 0.55,2.7436,133.99,131.25,Expired,134.36,-0.37000000000000455,2025-01-31,2025-02-25,16
XLE,Weekly Swing Trend Buy,buy,01/31/25,Target Hit,03/21/25,Weekly ATR5 x 0.55,0.8291,43.815,44.64,Expired,45.44,1.625,2025-01-31,2025-02-04,2
XLI,Weekly Swing Trend Buy,buy,01/31/25,Target Hit,03/21/25,Weekly ATR5 x 0.55,1.9704,135.93,137.9,Expired,154.368,18.437999999999988,2025-02-03,2025-02-07,4
DIA,Weekly Swing Trend Buy,buy,01/31/25,Target Hit,03/21/25,Weekly ATR5 x 0.55,5.64,439.61,445.25,Expired,477.66,38.05000000000001,2025-02-03,2025-02-04,1
GLD,Weekly Swing Trend Buy,buy,01/31/25,Target Hit,03/21/25,Weekly ATR5 x 0.55,2.8959,259.75,262.65,Expired,385.27,125.51999999999998,2025-01-31,2025-02-05,3
EEM,Donchian Crossover Buy,buy,02/07/25,Target Hit,04/17/25,ATR5 x 1.0,0.5141,43.62,44.13,Expired,54.622296,11.002296000000001,2025-02-07,2025-02-14,5
IBB,ETF Squeeze Sell,sell,02/07/25,Target Hit,04/17/25,ATR5 x 1.0,2.7159,138.07,135.35,Expired,170.04,-31.97,2025-02-07,2025-02-11,2
SLV,ETF Squeeze Sell,sell,02/07/25,Target Hit,04/17/25,ATR5 x 1.0,0.6152,29.15,28.53,Expired,52.6699,-23.5199,2025-02-07,2025-02-25,11
TLT,ETF Squeeze Sell,sell,02/07/25,Target Hit,04/17/25,ATR5 x 1.0,1.0127,89.264,88.25,Expired,87.805,1.458999999999989,2025-02-07,2025-02-12,3
EWH,Weekly Swing Trend Buy,buy,02/07/25,Target Hit,04/17/25,Weekly ATR5 x 0.55,0.2164,16.35,16.57,Expired,21.815,5.465,2025-02-07,2025-02-12,3
SLV,Weekly Swing Trend Buy,buy,02/07/25,Target Hit,04/17/25,Weekly ATR5 x 0.55,0.5985,29.15,29.75,Expired,52.6699,23.5199,2025-02-07,2025-02-14,5
XHB,Weekly Swing Trend Buy,buy,02/07/25,Expired,04/17/25,Weekly ATR5 x 0.55,2.4785,105.82,108.3,Expired,105.75,-0.06999999999999318,2025-02-07,2025-04-17,48
DIA,Squeeze Play Sector Sell,sell,02/14/25,Target Hit,04/17/25,ATR5 x 1.0,4.041,445.28,441.24,Expired,477.66,-32.38000000000005,2025-02-14,2025-02-20,3
EEM,Weekly 10.5 Squeeze Buy,buy,02/14/25,Target Hit,04/17/25,Weekly ATR5 x 0.55,0.6513,44.76,45.41,Expired,54.622296,9.862296,2025-02-14,2025-02-21,4
EWH,Weekly 10.5 Squeeze Buy,buy,02/14/25,Target Hit,04/17/25,Weekly ATR5 x 0.55,0.2776,16.93,17.21,Expired,21.815,4.885000000000002,2025-02-18,2025-02-21,3
FXI,Weekly 10.5 Squeeze Buy,buy,02/14/25,Target Hit,04/17/25,Weekly ATR5 x 0.55,0.9784,35.57,36.55,Expired,39.435,3.865000000000002,2025-02-14,2025-02-21,4
EFA,Weekly Swing Trend Buy,buy,02/14/25,Target Hit,04/17/25,Weekly ATR5 x 0.55,1.1402,82.47,83.61,Expired,95.47,13.0,2025-02-14,2025-03-05,12
GDX,Weekly Swing Trend Buy,buy,02/14/25,Target Hit,04/17/25,Weekly ATR5 x 0.55,1.0437,41.64,42.68,Expired,79.91,38.269999999999996,2025-02-14,2025-03-13,18
XLV,Weekly Swing Trend Buy,buy,02/14/25,Target Hit,04/17/25,Weekly ATR5 x 0.55,1.576,143.92,145.5,Expired,151.52,7.600000000000023,2025-02-18,2025-02-19,1
USO,Weekly Turbo Hook Buy,buy,02/14/25,Target Hit,04/17/25,Weekly ATR5 x 0.55,1.5726,76.69,78.26,Expired,70.405,-6.284999999999997,2025-02-14,2025-02-20,3
XLE,Weekly 10.5 Squeeze Buy,buy,02/21/25,Target Hit,04/17/25,Weekly ATR5 x 0.55,0.8886,45.545,46.43,Expired,45.44,-0.10500000000000398,2025-02-21,2025-03-19,18
EEM,Weekly Swing Trend Buy,buy,02/21/25,Target Hit,04/17/25,Weekly ATR5 x 0.55,0.6321,44.65,45.28,Expired,54.622296,9.972296,2025-02-24,2025-03-17,15
IBB,Weekly Turbo Hook Buy,buy,02/21/25,Expired,04/17/25,Weekly ATR5 x 0.55,2.4765,139.06,141.54,Expired,170.04,30.97999999999999,2025-02-21,2025-04-17,39
XLK,Donchian Crossover Buy,buy,02/24/25,Expired,04/17/25,ATR5 x 1.0,2.085,115.51,117.59,Expired,147.16,31.64999999999999,2025-02-24,2025-04-17,38
TLT,Donchian Crossover Buy,buy,02/24/25,Target Hit,04/17/25,ATR5 x 1.0,0.968,90.97,91.94,Expired,87.805,-3.164999999999992,2025-02-24,2025-02-26,2
FXI,ETF Squeeze Sell,sell,02/24/25,Target Hit,04/17/25,ATR5 x 1.0,0.9489,35.47,34.52,Expired,39.435,-3.9650000000000034,2025-02-24,2025-03-03,5
VWO,ETF Squeeze Sell,sell,02/24/25,Target Hit,04/17/25,ATR5 x 1.0,0.535,45.72,45.19,Expired,54.205,-8.485,2025-02-24,2025-02-28,4
VWO,Weekly Swing Trend Buy,buy,02/28/25,Target Hit,04/17/25,Weekly ATR5 x 0.55,0.6955,44.93,45.63,Expired,54.205,9.274999999999999,2025-02-28,2025-03-05,3
QQQ,Stochastics Hook Put/Call Buy (Setup 4),buy,03/05/25,Target Hit,05/16/25,ATR5 x 1.0,13.0122,493.69,506.7,Expired,622.48,128.79000000000002,2025-03-05,2025-05-12,47
XLK,Stochastics Hook Put/Call Buy (Setup 4),buy,03/05/25,Target Hit,05/16/25,ATR5 x 1.0,3.3295,108.51,111.84,Expired,147.16,38.64999999999999,2025-03-05,2025-05-12,47
QQQ,Gap and Go Put/Call Buy (Setup 6),buy,03/05/25,Target Hit,05/16/25,ATR5 x 1.0,13.0122,493.69,506.7,Expired,622.48,128.79000000000002,2025-03-05,2025-05-12,47
XLK,Gap and Go Put/Call Buy (Setup 6),buy,03/05/25,Target Hit,05/16/25,ATR5 x 1.0,3.3295,108.51,111.84,Expired,147.16,38.64999999999999,2025-03-05,2025-05-12,47
TLT,ETF Squeeze Sell,sell,03/05/25,Target Hit,05/16/25,ATR5 x 1.0,1.1848,90.48,89.3,Expired,87.805,2.674999999999997,2025-03-05,2025-03-26,15
EWH,Weekly Swing Trend Buy,buy,03/07/25,Target Hit,05/16/25,Weekly ATR5 x 0.55,0.3758,18.08,18.46,Expired,21.815,3.735000000000003,2025-03-10,2025-03-19,7
IBB,Weekly Swing Sell,sell,03/14/25,Target Hit,05/16/25,Weekly ATR5 x 0.55,2.7258,133.78,131.05,Expired,170.04,-36.25999999999999,2025-03-14,2025-03-26,8
IYR,Weekly Swing Trend Buy,buy,03/14/25,Target Hit,05/16/25,Weekly ATR5 x 0.55,1.8418,94.5,96.34,Expired,94.859,0.35899999999999466,2025-03-14,2025-03-17,1
VNQ,Weekly Swing Trend Buy,buy,03/14/25,Target Hit,05/16/25,Weekly ATR5 x 0.55,1.7668,90.04,91.81,Expired,89.38,-0.6600000000000108,2025-03-14,2025-03-17,1
XLE,Weekly 10.5 Squeeze Buy,buy,03/21/25,Target Hit,05/16/25,Weekly ATR5 x 0.55,1.0675,46.11,47.18,Expired,45.44,-0.6700000000000017,2025-03-21,2025-03-26,3
QQQ,Ichimoku Tenkan Hook Put/Call Buy (Setup 2),buy,03/25/25,Target Hit,05/16/25,ATR5 x 1.0,8.9934,492.3,501.29,Expired,622.48,130.18,2025-03-25,2025-05-12,33
SPY,Ichimoku Tenkan Hook Put/Call Buy (Setup 2),buy,03/25/25,Target Hit,05/16/25,ATR5 x 1.0,8.3285,575.19,583.52,Expired,682.55,107.3599999999999,2025-03-25,2025-05-13,34
XLK,Ichimoku Tenkan Hook Put/Call Buy (Setup 2),buy,03/25/25,Target Hit,05/16/25,ATR5 x 1.0,2.0444,108.84,110.88,Expired,147.16,38.31999999999999,2025-03-25,2025-05-12,33
QQQ,Stochastics Hook Put/Call Buy (Setup 4),buy,03/25/25,Target Hit,05/16/25,ATR5 x 1.0,8.9934,492.3,501.29,Expired,622.48,130.18,2025-03-25,2025-05-12,33
DIA,20.8 Trigger Lines Put/Call Buy (Setup 5),buy,03/25/25,Expired,05/16/25,ATR5 x 1.0,5.5218,426.33,431.85,Expired,477.66,51.33000000000004,2025-03-25,2025-05-16,37
SPY,20.8 Trigger Lines Put/Call Buy (Setup 5),buy,03/25/25,Target Hit,05/16/25,ATR5 x 1.0,8.3285,575.19,583.52,Expired,682.55,107.3599999999999,2025-03-25,2025-05-13,34
XLI,20.8 Trigger Lines Put/Call Buy (Setup 5),buy,03/25/25,Target Hit,05/16/25,ATR5 x 1.0,2.0099,134.7,136.71,Expired,154.368,19.668000000000006,2025-03-25,2025-05-08,31
QQQ,Gap and Go Put/Call Buy (Setup 6),buy,03/25/25,Target Hit,05/16/25,ATR5 x 1.0,8.9934,492.3,501.29,Expired,622.48,130.18,2025-03-25,2025-05-12,33
XME,Donchian Hook Buy,buy,03/25/25,Expired,05/16/25,ATR5 x 1.0,1.378,59.08,60.46,Expired,98.33,39.25,2025-03-25,2025-05-16,37
IYR,Weekly Turbo Hook Buy,buy,03/28/25,Expired,05/16/25,Weekly ATR5 x 0.55,1.6262,94.79,96.42,Expired,94.859,0.0689999999999884,2025-03-28,2025-05-16,34
IYR,Weekly Turbo Hook Buy,buy,03/28/25,Expired,05/16/25,Weekly ATR5 x 0.55,1.6262,94.79,96.42,Expired,94.859,0.0689999999999884,2025-03-28,2025-05-16,34
EWH,Weekly Ichimoku Squeeze Sell,sell,03/31/25,Target Hit,05/16/25,ATR5 x 1.0,0.2322,17.6,17.37,Expired,21.815,-4.215,2025-03-31,2025-04-04,4
FXI,Weekly Ichimoku Squeeze Sell,sell,03/31/25,Target Hit,05/16/25,ATR5 x 1.0,0.6658,35.69,35.02,Expired,39.435,-3.7450000000000045,2025-03-31,2025-04-03,3
EWH,Weekly Ichimoku Squeeze Sell,sell,03/31/25,Target Hit,05/16/25,ATR20 x 1.0,0.2473,17.6,17.35,Expired,21.815,-4.215,2025-04-01,2025-04-04,3
FXI,Weekly Ichimoku Squeeze Sell,sell,03/31/25,Target Hit,05/16/25,ATR20 x 1.0,0.76,35.69,34.93,Expired,39.435,-3.7450000000000045,2025-03-31,2025-04-03,3
IYR,Donchian T-Lines Buy/Sell,buy,04/02/25,Expired,06/20/25,ATR5 x 1.0,1.4164,95.24,96.66,Expired,94.859,-0.3810000000000002,2025-04-02,2025-06-20,54
VNQ,Donchian T-Lines Buy/Sell,buy,04/02/25,Target Hit,06/20/25,ATR5 x 1.0,1.4029,89.715,91.12,Expired,89.38,-0.33500000000000796,2025-04-02,2025-06-11,48
IYR,Donchian Hook Buy,buy,04/02/25,Expired,06/20/25,ATR5 x 1.0,1.4164,95.24,96.66,Expired,94.859,-0.3810000000000002,2025-04-02,2025-06-20,54
VNQ,Donchian Hook Buy,buy,04/02/25,Target Hit,06/20/25,ATR5 x 1.0,1.4029,89.715,91.12,Expired,89.38,-0.33500000000000796,2025-04-02,2025-06-11,48
QQQ,Squeeze Play Sector Sell,sell,04/03/25,Target Hit,06/20/25,ATR5 x 1.0,13.8263,438.14,424.31,Expired,622.48,-184.34000000000003,2025-04-03,2025-04-04,1
SPY,Squeeze Play Sector Sell,sell,04/03/25,Target Hit,06/20/25,ATR5 x 1.0,13.7845,523.67,509.89,Expired,682.55,-158.88,2025-04-03,2025-04-04,1
XLI,Squeeze Play Sector Sell,sell,04/03/25,Target Hit,06/20/25,ATR5 x 1.0,3.5229,122.25,118.73,Expired,154.368,-32.117999999999995,2025-04-03,2025-04-04,1
XLK,Squeeze Play Sector Sell,sell,04/03/25,Target Hit,06/20/25,ATR5 x 1.0,3.4631,94.57,91.11,Expired,147.16,-52.59,2025-04-03,2025-04-07,2
IWM,Donchian T-Lines Buy/Sell,sell,04/03/25,Target Hit,06/20/25,ATR5 x 1.0,6.519,182.61,176.09,Expired,251.1,-68.48999999999998,2025-04-03,2025-04-07,2
QQQ,Donchian T-Lines Buy/Sell,sell,04/03/25,Target Hit,06/20/25,ATR5 x 1.0,13.8263,438.14,424.31,Expired,622.48,-184.34000000000003,2025-04-03,2025-04-04,1
SPY,Donchian T-Lines Buy/Sell,sell,04/03/25,Target Hit,06/20/25,ATR5 x 1.0,13.7845,523.67,509.89,Expired,682.55,-158.88,2025-04-03,2025-04-04,1
VNQ,Donchian T-Lines Buy/Sell,sell,04/03/25,Target Hit,06/20/25,ATR5 x 1.0,1.7564,87.11,85.35,Expired,89.38,-2.269999999999996,2025-04-03,2025-04-04,1
XLI,Donchian T-Lines Buy/Sell,sell,04/03/25,Target Hit,06/20/25,ATR5 x 1.0,3.5229,122.25,118.73,Expired,154.368,-32.117999999999995,2025-04-03,2025-04-04,1
XOP,Donchian T-Lines Buy/Sell,sell,04/03/25,Target Hit,06/20/25,ATR5 x 1.0,5.134,113.87,108.74,Expired,134.36,-20.49000000000001,2025-04-03,2025-04-04,1
USO,ETF Squeeze Sell,sell,04/03/25,Target Hit,06/20/25,ATR5 x 1.0,2.3588,66.9,64.54,Expired,70.405,-3.5049999999999955,2025-04-03,2025-04-08,3
IYR,Weekly 10.5 Squeeze Buy,buy,04/17/25,Target Hit,06/20/25,Weekly ATR5 x 0.55,2.6536,91.15,93.8,Expired,94.859,3.708999999999989,2025-04-17,2025-04-23,3
IYR,Weekly 10.5 Squeeze Buy,buy,04/17/25,Target Hit,06/20/25,Weekly ATR5 x 0.55,2.6536,91.15,93.8,Expired,94.859,3.708999999999989,2025-04-17,2025-04-23,3
QQQ,Ichimoku Tenkan Flat Put/Call Buy (Setup 3),buy,04/22/25,Target Hit,06/20/25,ATR5 x 1.0,16.8123,458.17,474.98,Expired,622.48,164.31,2025-04-22,2025-04-29,5
XLI,Ichimoku Tenkan Flat Put/Call Buy (Setup 3),buy,04/22/25,Target Hit,06/20/25,ATR5 x 1.0,3.6967,128.03,131.73,Expired,154.368,26.337999999999994,2025-04-22,2025-05-01,7
XLK,Ichimoku Tenkan Flat Put/Call Buy (Setup 3),buy,04/22/25,Target Hit,06/20/25,ATR5 x 1.0,3.9686,99.92,103.89,Expired,147.16,47.239999999999995,2025-04-22,2025-04-25,3
EFA,Donchian Hook Buy,buy,04/22/25,Target Hit,06/20/25,ATR5 x 1.0,1.9149,83.12,85.03,Expired,95.47,12.349999999999994,2025-04-22,2025-04-29,5
IWM,Weekly 10.5 Squeeze Buy,buy,04/25/25,Target Hit,06/20/25,Weekly ATR5 x 0.55,7.0998,194.5,201.6,Expired,251.1,56.599999999999994,2025-04-25,2025-05-08,9
QQQ,Weekly 10.5 Squeeze Buy,buy,04/25/25,Target Hit,06/20/25,Weekly ATR5 x 0.55,20.1833,473.03,493.21,Expired,622.48,149.45000000000005,2025-04-25,2025-05-12,11
SPY,Weekly 10.5 Squeeze Buy,buy,04/25/25,Target Hit,06/20/25,Weekly ATR5 x 0.55,19.4058,551.39,570.8,Expired,682.55,131.15999999999997,2025-04-25,2025-05-12,11
XLK,Weekly 10.5 Squeeze Buy,buy,04/25/25,Target Hit,06/20/25,Weekly ATR5 x 0.55,5.1527,104.1,109.25,Expired,147.16,43.06,2025-04-25,2025-05-08,9
DIA,Weekly Swing Trend Buy,buy,04/25/25,Target Hit,06/20/25,Weekly ATR5 x 0.55,12.5095,401.8,414.31,Expired,477.66,75.86000000000001,2025-04-25,2025-05-05,6
EEM,Donchian Crossover Buy,buy,05/02/25,Target Hit,07/18/25,ATR5 x 1.0,0.6713,45.46,46.13,Expired,54.622296,9.162295999999998,2025-05-02,2025-05-13,7
EEM,Weekly Swing Trend Buy,buy,05/02/25,Target Hit,07/18/25,Weekly ATR5 x 0.55,1.0641,45.46,46.52,Expired,54.622296,9.162295999999998,2025-05-02,2025-05-21,13
IBB,Weekly Swing Trend Buy,buy,05/09/25,Target Hit,07/18/25,Weekly ATR5 x 0.55,4.2657,117.96,122.23,Expired,170.04,52.08,2025-05-09,2025-05-12,1
XLV,Weekly Swing Trend Buy,buy,05/09/25,Target Hit,07/18/25,Weekly ATR5 x 0.55,3.0888,132.875,135.96,Expired,151.52,18.64500000000001,2025-05-09,2025-05-12,1
IYR,Donchian Crossover Buy,buy,05/09/25,Expired,07/18/25,ATR5 x 1.0,1.2761,95.52,96.8,Expired,94.859,-0.6610000000000014,2025-05-09,2025-07-18,47
XLF,Donchian Crossover Buy,buy,05/09/25,Target Hit,07/18/25,ATR5 x 1.0,0.7557,51.11,51.87,Expired,53.48,2.3699999999999974,2025-05-09,2025-06-27,33
IBB,Donchian T-Lines Buy/Sell,sell,05/09/25,Expired,07/18/25,ATR5 x 1.0,3.6391,117.96,114.32,Expired,170.04,-52.08,2025-05-09,2025-07-18,47
DIA,Donchian Crossover Buy,buy,05/12/25,Target Hit,07/18/25,ATR5 x 1.0,6.8769,422.68,429.56,Expired,477.66,54.98000000000002,2025-05-12,2025-06-06,18
FXI,Donchian Crossover Buy,buy,05/12/25,Target Hit,07/18/25,ATR5 x 1.0,0.7135,35.61,36.32,Expired,39.435,3.825000000000003,2025-05-12,2025-05-14,2
SPY,Donchian Crossover Buy,buy,05/12/25,Target Hit,07/18/25,ATR5 x 1.0,10.3839,583.41,593.79,Expired,682.55,99.13999999999999,2025-05-12,2025-05-16,4
VNQ,Donchian Crossover Buy,buy,05/12/25,Target Hit,07/18/25,ATR5 x 1.0,1.2468,89.58,90.83,Expired,89.38,-0.20000000000000284,2025-05-12,2025-06-11,21
XLB,Donchian Crossover Buy,buy,05/12/25,Target Hit,07/18/25,ATR5 x 1.0,0.8094,43.28,44.09,Expired,43.535,0.25499999999999545,2025-05-12,2025-06-04,16
DIA,Ichimoku Kijun 5 Hook Buy,buy,05/12/25,Target Hit,07/18/25,ATR5 x 1.0,6.8769,422.68,429.56,Expired,477.66,54.98000000000002,2025-05-12,2025-06-06,18
IWM,Ichimoku Kijun 5 Hook Buy,buy,05/12/25,Target Hit,07/18/25,ATR5 x 1.0,4.7943,208.93,213.72,Expired,251.1,42.16999999999999,2025-05-12,2025-06-09,19
XHB,Ichimoku Kijun 5 Hook Buy,buy,05/12/25,Target Hit,07/18/25,ATR5 x 1.0,2.7086,101.55,104.26,Expired,105.75,4.200000000000003,2025-05-12,2025-07-01,34
XLI,Ichimoku Kijun 5 Hook Buy,buy,05/12/25,Target Hit,07/18/25,ATR5 x 1.0,2.5964,140.75,143.35,Expired,154.368,13.617999999999995,2025-05-12,2025-05-16,4
XRT,Ichimoku Kijun 5 Hook Buy,buy,05/12/25,Target Hit,07/18/25,ATR5 x 1.0,2.0711,74.86,76.93,Expired,86.09,11.230000000000004,2025-05-12,2025-05-20,6
EWH,Weekly Swing Trend Buy,buy,05/16/25,Target Hit,07/18/25,Weekly ATR5 x 0.55,0.4345,18.81,19.24,Expired,21.815,3.0050000000000026,2025-05-16,2025-06-03,11
QQQ,Weekly Swing Trend Buy,buy,05/16/25,Target Hit,07/18/25,Weekly ATR5 x 0.55,17.4752,514.24,531.72,Expired,622.48,108.24000000000001,2025-05-19,2025-06-05,12
SPY,Weekly Swing Trend Buy,buy,05/16/25,Target Hit,07/18/25,Weekly ATR5 x 0.55,16.4001,588.1,604.5,Expired,682.55,94.44999999999993,2025-05-19,2025-06-11,16
XLK,Weekly Swing Trend Buy,buy,05/16/25,Target Hit,07/18/25,Weekly ATR5 x 0.55,4.4903,115.71,120.2,Expired,147.16,31.450000000000003,2025-05-19,2025-06-09,14
XLE,Weekly 10.5 Squeeze Buy,buy,05/16/25,Target Hit,07/18/25,Weekly ATR5 x 0.55,1.295,42.385,43.68,Expired,45.44,3.0549999999999997,2025-05-16,2025-06-13,19
XOP,Weekly 10.5 Squeeze Buy,buy,05/16/25,Target Hit,07/18/25,Weekly ATR5 x 0.55,5.0972,124.49,129.59,Expired,134.36,9.870000000000019,2025-05-16,2025-06-13,19
IWM,ETF Squeeze Sell,sell,05/19/25,Target Hit,07/18/25,ATR5 x 1.0,3.381,208.66,205.28,Expired,251.1,-42.44,2025-05-19,2025-05-21,2
QQQ,ETF Squeeze Sell,sell,05/19/25,Target Hit,07/18/25,ATR5 x 1.0,8.026,519.47,511.44,Expired,622.48,-103.00999999999999,2025-05-19,2025-05-21,2
XLI,ETF Squeeze Sell,sell,05/19/25,Target Hit,07/18/25,ATR5 x 1.0,2.0557,143.69,141.63,Expired,154.368,-10.677999999999997,2025-05-19,2025-05-21,2
IYR,Donchian T-Lines Buy/Sell,sell,05/21/25,Expired,07/18/25,ATR5 x 1.0,1.5219,92.66,91.14,Expired,94.859,-2.198999999999998,2025-05-21,2025-07-18,39
VNQ,Donchian T-Lines Buy/Sell,sell,05/21/25,Expired,07/18/25,ATR5 x 1.0,1.4309,87.46,86.03,Expired,89.38,-1.9200000000000017,2025-05-21,2025-07-18,39
XRT,ETF Squeeze Sell,sell,05/21/25,Expired,07/18/25,ATR5 x 1.0,1.5931,74.56,72.97,Expired,86.09,-11.530000000000001,2025-05-21,2025-07-18,39
GDX,Donchian T-Lines Buy/Sell,buy,05/22/25,Target Hit,07/18/25,ATR5 x 1.0,1.2459,50.35,51.6,Expired,79.91,29.559999999999995,2025-05-22,2025-06-02,6
XHB,Donchian T-Lines Buy/Sell,sell,05/22/25,Target Hit,07/18/25,ATR5 x 1.0,2.2106,94.05,91.84,Expired,105.75,-11.700000000000003,2025-05-22,2025-06-02,6
XME,ETF Squeeze Sell,sell,05/29/25,Expired,07/18/25,ATR5 x 1.0,1.1559,59.75,58.59,Expired,98.33,-38.58,2025-05-29,2025-07-18,34
QQQ,Weekly Swing Trend Buy,buy,05/30/25,Target Hit,07/18/25,Weekly ATR5 x 0.55,14.6135,517.24,531.85,Expired,622.48,105.24000000000001,2025-05-30,2025-06-05,4
DIA,20.8 Trigger Lines Put/Call Buy (Setup 5),buy,06/02/25,Target Hit,08/15/25,ATR5 x 1.0,5.0143,423.07,428.08,Expired,477.66,54.59000000000003,2025-06-02,2025-06-06,4
XLI,20.8 Trigger Lines Put/Call Buy (Setup 5),buy,06/02/25,Target Hit,08/15/25,ATR5 x 1.0,1.8594,142.61,144.47,Expired,154.368,11.757999999999981,2025-06-02,2025-06-04,2
IYR,Donchian T-Lines Buy/Sell,buy,06/03/25,Target Hit,08/15/25,ATR5 x 1.0,1.3059,94.51,95.82,Expired,94.859,0.34899999999998954,2025-06-03,2025-06-10,5
VNQ,Donchian T-Lines Buy/Sell,buy,06/03/25,Target Hit,08/15/25,ATR5 x 1.0,1.2253,89.22,90.45,Expired,89.38,0.1599999999999966,2025-06-03,2025-06-09,4
XLI,Squeeze Play Sector Sell,sell,06/05/25,Target Hit,08/15/25,ATR5 x 1.0,1.4828,145.0,143.52,Expired,154.368,-9.367999999999995,2025-06-05,2025-06-10,3
XLV,Donchian Hook Buy,buy,06/05/25,Target Hit,08/15/25,ATR5 x 1.0,1.6891,133.81,135.5,Expired,151.52,17.710000000000008,2025-06-05,2025-06-10,3
XLF,Weekly Swing Trend Buy,buy,06/06/25,Target Hit,08/15/25,Weekly ATR5 x 0.55,1.0724,51.34,52.41,Expired,53.48,2.1399999999999935,2025-06-06,2025-06-30,15
DIA,Donchian T-Lines Buy/Sell,buy,06/10/25,Target Hit,08/15/25,ATR5 x 1.0,3.9197,429.86,433.78,Expired,477.66,47.80000000000001,2025-06-10,2025-06-26,11
XLE,Donchian T-Lines Buy/Sell,buy,06/11/25,Target Hit,08/15/25,ATR5 x 1.0,0.8279,42.945,43.77,Expired,45.44,2.4949999999999974,2025-06-11,2025-06-13,2
XOP,Donchian T-Lines Buy/Sell,buy,06/11/25,Target Hit,08/15/25,ATR5 x 1.0,3.2605,127.38,130.64,Expired,134.36,6.980000000000018,2025-06-11,2025-06-13,2
XHB,Donchian Hook Buy,buy,06/11/25,Target Hit,08/15/25,ATR5 x 1.0,2.0909,96.35,98.44,Expired,105.75,9.400000000000006,2025-06-11,2025-06-24,8
XHB,Donchian T-Lines Buy/Sell,buy,06/12/25,Target Hit,08/15/25,ATR5 x 1.0,2.0267,95.65,97.68,Expired,105.75,10.099999999999994,2025-06-12,2025-06-24,7
FXI,ETF Squeeze Sell,sell,06/13/25,Target Hit,08/15/25,ATR5 x 1.0,0.4812,36.67,36.19,Expired,39.435,-2.7650000000000006,2025-06-13,2025-06-18,3
IBB,ETF Squeeze Sell,sell,06/13/25,Target Hit,08/15/25,ATR5 x 1.0,2.1852,128.45,126.26,Expired,170.04,-41.59,2025-06-13,2025-06-17,2
VWO,ETF Squeeze Sell,sell,06/13/25,Target Hit,08/15/25,ATR5 x 1.0,0.4476,48.85,48.4,Expired,54.205,-5.354999999999997,2025-06-13,2025-06-17,2
XLV,Ichimoku Kijun 5 Hook Buy,buy,06/13/25,Expired,08/15/25,ATR5 x 1.0,1.5754,136.42,138.0,Expired,151.52,15.100000000000023,2025-06-13,2025-08-15,43
DIA,Weekly Swing Trend Buy,buy,06/13/25,Target Hit,08/15/25,Weekly ATR5 x 0.55,7.6666,425.05,432.72,Expired,477.66,52.610000000000014,2025-06-13,2025-06-26,8
XLV,Weekly 10.5 Squeeze Buy,buy,06/13/25,Expired,08/15/25,Weekly ATR5 x 0.55,2.6924,136.42,139.11,Expired,151.52,15.100000000000023,2025-06-13,2025-08-15,43
EWG,Weekly Ichimoku Squeeze Sell,sell,06/13/25,Target Hit,08/15/25,ATR20 x 1.0,0.5296,41.17,40.64,Expired,41.335,-0.16499999999999915,2025-06-13,2025-06-17,2
SLV,ETF Squeeze Sell,sell,06/16/25,Target Hit,08/15/25,ATR5 x 1.0,0.4465,33.63,33.18,Expired,52.6699,-19.039899999999996,2025-06-16,2025-06-20,3
XME,ETF Squeeze Sell,sell,06/20/25,Expired,08/15/25,ATR5 x 1.0,1.3115,65.47,64.16,Expired,98.33,-32.86,2025-06-20,2025-08-15,39
EWH,Weekly Ichimoku Squeeze Sell,sell,06/20/25,Expired,08/15/25,ATR20 x 1.0,0.2109,19.27,19.05,Expired,21.815,-2.5450000000000017,2025-06-23,2025-08-15,38
XLV,Donchian T-Lines Buy/Sell,sell,06/23/25,Target Hit,08/15/25,ATR5 x 1.0,1.6904,132.51,130.82,Expired,151.52,-19.01000000000002,2025-06-23,2025-07-31,27
USO,ETF Squeeze Sell,sell,06/23/25,Expired,08/15/25,ATR5 x 1.0,3.7638,73.34,69.58,Expired,70.405,2.9350000000000023,2025-06-23,2025-08-15,38
DIA,20.8 Trigger Lines Put/Call Buy (Setup 5),buy,06/25/25,Target Hit,08/15/25,ATR5 x 1.0,4.4975,430.82,435.32,Expired,477.66,46.84000000000003,2025-06-25,2025-06-27,2
XLI,20.8 Trigger Lines Put/Call Buy (Setup 5),buy,06/25/25,Target Hit,08/15/25,ATR5 x 1.0,1.7211,144.41,146.13,Expired,154.368,9.957999999999998,2025-06-25,2025-06-27,2
DIA,Donchian T-Lines Buy/Sell,buy,06/25/25,Target Hit,08/15/25,ATR5 x 1.0,4.4975,430.82,435.32,Expired,477.66,46.84000000000003,2025-06-25,2025-06-27,2
XLF,Donchian T-Lines Buy/Sell,buy,06/25/25,Target Hit,08/15/25,ATR5 x 1.0,0.6455,51.44,52.09,Expired,53.48,2.039999999999999,2025-06-25,2025-06-27,2
EEM,Ichimoku Kijun 5 Hook Buy,buy,06/25/25,Target Hit,08/15/25,ATR5 x 1.0,0.5422,48.175,48.72,Expired,54.622296,6.4472960000000015,2025-06-25,2025-07-03,6
GDX,Ichimoku Kijun 5 Hook Buy,buy,06/25/25,Target Hit,08/15/25,ATR5 x 1.0,1.2885,51.76,53.05,Expired,79.91,28.15,2025-06-25,2025-07-07,7
IBB,Ichimoku Kijun 5 Hook Buy,buy,06/25/25,Target Hit,08/15/25,ATR5 x 1.0,2.2539,127.06,129.31,Expired,170.04,42.97999999999999,2025-06-25,2025-07-01,4
XLB,Ichimoku Kijun 5 Hook Buy,buy,06/25/25,Target Hit,08/15/25,ATR5 x 1.0,0.5374,43.625,44.16,Expired,43.535,-0.09000000000000341,2025-06-25,2025-07-01,4
XLV,Ichimoku Kijun 5 Hook Buy,buy,06/25/25,Target Hit,08/15/25,ATR5 x 1.0,1.7197,134.18,135.9,Expired,151.52,17.340000000000003,2025-06-25,2025-07-01,4
XLI,Donchian T-Lines Buy/Sell,buy,06/26/25,Target Hit,08/15/25,ATR5 x 1.0,1.7228,145.76,147.48,Expired,154.368,8.608000000000004,2025-06-26,2025-06-30,2
DIA,Weekly Turbo Hook Buy,buy,06/27/25,Target Hit,08/15/25,Weekly ATR5 x 0.55,7.7583,440.45,448.21,Expired,477.66,37.210000000000036,2025-06-27,2025-07-03,4
EFA,Weekly Turbo Hook Buy,buy,06/27/25,Target Hit,08/15/25,Weekly ATR5 x 0.55,1.386,89.12,90.51,Expired,95.47,6.349999999999994,2025-06-27,2025-07-23,17
EWG,Donchian T-Lines Buy/Sell,buy,07/01/25,Target Hit,09/19/25,ATR5 x 1.0,0.5277,41.92,42.45,Expired,41.335,-0.5850000000000009,2025-07-01,2025-07-08,4
XHB,Ichimoku Kijun 5 Hook Buy,buy,07/01/25,Target Hit,09/19/25,ATR5 x 1.0,2.8328,102.82,105.65,Expired,105.75,2.930000000000007,2025-07-01,2025-07-10,6
EFA,Donchian T-Lines Buy/Sell,buy,07/02/25,Target Hit,09/19/25,ATR5 x 1.0,0.7752,89.435,90.21,Expired,95.47,6.034999999999997,2025-07-02,2025-07-23,14
TLT,ETF Squeeze Sell,sell,07/02/25,Target Hit,09/19/25,ATR5 x 1.0,0.9095,87.165,86.26,Expired,87.805,-0.6400000000000006,2025-07-02,2025-07-07,2
IBB,Donchian T-Lines Buy/Sell,buy,07/03/25,Target Hit,09/19/25,ATR5 x 1.0,2.1536,129.41,131.56,Expired,170.04,40.629999999999995,2025-07-03,2025-07-09,3
IYR,Donchian T-Lines Buy/Sell,buy,07/03/25,Target Hit,09/19/25,ATR5 x 1.0,1.2572,95.26,96.52,Expired,94.859,-0.40100000000001046,2025-07-03,2025-07-21,11
XME,ETF Squeeze Sell,sell,07/07/25,Expired,09/19/25,ATR5 x 1.0,1.5391,69.34,67.8,Expired,98.33,-28.989999999999995,2025-07-07,2025-09-19,53
EFA,Donchian Hook Buy,buy,07/09/25,Target Hit,09/19/25,ATR5 x 1.0,0.7613,89.63,90.39,Expired,95.47,5.840000000000003,2025-07-09,2025-07-23,10
IYR,Donchian T-Lines Buy/Sell,buy,07/10/25,Target Hit,09/19/25,ATR5 x 1.0,1.1957,95.03,96.23,Expired,94.859,-0.17100000000000648,2025-07-10,2025-07-21,7
SLV,Donchian T-Lines Buy/Sell,buy,07/10/25,Target Hit,09/19/25,ATR5 x 1.0,0.5016,34.2,34.7,Expired,52.6699,18.469899999999996,2025-07-10,2025-07-11,1
XLE,Donchian T-Lines Buy/Sell,buy,07/10/25,Target Hit,09/19/25,ATR5 x 1.0,0.7614,44.29,45.05,Expired,45.44,1.1499999999999986,2025-07-10,2025-08-29,36
EWG,Weekly Ichimoku Squeeze Sell,sell,07/11/25,Target Hit,09/19/25,ATR20 x 1.0,0.505,42.02,41.52,Expired,41.335,0.6850000000000023,2025-07-11,2025-07-30,13
VNQ,Donchian T-Lines Buy/Sell,buy,07/14/25,Target Hit,09/19/25,ATR5 x 1.0,1.0885,90.34,91.43,Expired,89.38,-0.960000000000008,2025-07-14,2025-07-22,6
IBB,ETF Squeeze Sell,sell,07/15/25,Expired,09/19/25,ATR5 x 1.0,2.6082,129.48,126.87,Expired,170.04,-40.56,2025-07-15,2025-09-19,47
IWM,ETF Squeeze Sell,sell,07/15/25,Target Hit,09/19/25,ATR5 x 1.0,3.5202,220.22,216.7,Expired,251.1,-30.879999999999995,2025-07-15,2025-08-01,13
XHB,ETF Squeeze Sell,sell,07/15/25,Expired,09/19/25,ATR5 x 1.0,2.777,101.01,98.23,Expired,105.75,-4.739999999999995,2025-07-15,2025-09-19,47
XLB,ETF Squeeze Sell,sell,07/15/25,Target Hit,09/19/25,ATR5 x 1.0,0.6586,44.625,43.97,Expired,43.535,1.0900000000000034,2025-07-15,2025-07-31,12
XLI,ETF Squeeze Sell,sell,07/15/25,Target Hit,09/19/25,ATR5 x 1.0,1.3845,150.3,148.92,Expired,154.368,-4.067999999999984,2025-07-15,2025-07-16,1
XLV,ETF Squeeze Sell,sell,07/15/25,Target Hit,09/19/25,ATR5 x 1.0,1.9643,133.14,131.18,Expired,151.52,-18.380000000000024,2025-07-15,2025-07-21,4
XRT,ETF Squeeze Sell,sell,07/15/25,Target Hit,09/19/25,ATR5 x 1.0,1.3398,79.54,78.2,Expired,86.09,-6.549999999999997,2025-07-15,2025-07-16,1
EFA,Donchian Crossover Buy,buy,07/16/25,Target Hit,09/19/25,ATR5 x 1.0,0.7517,88.15,88.9,Expired,95.47,7.319999999999993,2025-07-16,2025-07-18,2
XOP,Donchian T-Lines Buy/Sell,buy,07/17/25,Target Hit,09/19/25,ATR5 x 1.0,3.0882,130.99,134.08,Expired,134.36,3.3700000000000045,2025-07-17,2025-09-02,32
IYR,Donchian Hook Buy,buy,07/17/25,Target Hit,09/19/25,ATR5 x 1.0,1.1264,95.68,96.81,Expired,94.859,-0.8210000000000122,2025-07-17,2025-07-22,3
GDX,Donchian Hook Buy,buy,07/18/25,Target Hit,09/19/25,ATR5 x 1.0,1.2059,51.935,53.14,Expired,79.91,27.974999999999994,2025-07-18,2025-07-21,1
EWH,ETF Squeeze Sell,sell,07/18/25,Expired,09/19/25,ATR5 x 1.0,0.1773,20.46,20.28,Expired,21.815,-1.3550000000000004,2025-07-18,2025-09-19,44
VWO,ETF Squeeze Sell,sell,07/18/25,Target Hit,09/19/25,ATR5 x 1.0,0.3392,50.67,50.33,Expired,54.205,-3.5349999999999966,2025-07-18,2025-07-30,8
GDX,Donchian T-Lines Buy/Sell,buy,07/21/25,Target Hit,09/19/25,ATR5 x 1.0,1.4087,53.64,55.05,Expired,79.91,26.269999999999996,2025-07-21,2025-08-04,10
XLF,Donchian T-Lines Buy/Sell,buy,07/25/25,Target Hit,09/19/25,ATR5 x 1.0,0.5118,53.38,53.89,Expired,53.48,0.09999999999999432,2025-07-25,2025-08-27,23
SLV,ETF Squeeze Sell,sell,07/25/25,Target Hit,09/19/25,ATR5 x 1.0,0.6348,34.65,34.02,Expired,52.6699,-18.0199,2025-07-25,2025-07-30,3
EFA,Weekly Turbo Hook Buy,buy,07/25/25,Target Hit,09/19/25,Weekly ATR5 x 0.55,1.1953,89.81,91.01,Expired,95.47,5.659999999999997,2025-07-28,2025-08-12,11
IBB,ETF Squeeze Sell,sell,07/28/25,Target Hit,09/19/25,ATR5 x 1.0,2.2775,133.97,131.69,Expired,170.04,-36.06999999999999,2025-07-28,2025-08-01,4
IYR,ETF Squeeze Sell,sell,07/28/25,Target Hit,09/19/25,ATR5 x 1.0,1.1443,96.78,95.64,Expired,94.859,1.9210000000000065,2025-07-28,2025-07-31,3
VNQ,ETF Squeeze Sell,sell,07/28/25,Target Hit,09/19/25,ATR5 x 1.0,1.0541,90.77,89.72,Expired,89.38,1.3900000000000006,2025-07-28,2025-07-31,3
XME,ETF Squeeze Sell,sell,07/28/25,Target Hit,09/19/25,ATR5 x 1.0,1.7566,75.99,74.23,Expired,98.33,-22.340000000000003,2025-07-28,2025-07-30,2
TLT,Donchian T-Lines Buy/Sell,buy,07/29/25,Target Hit,09/19/25,ATR5 x 1.0,0.8997,86.77,87.67,Expired,87.805,1.0350000000000108,2025-07-29,2025-08-01,3
XLE,Donchian T-Lines Buy/Sell,buy,07/29/25,Target Hit,09/19/25,ATR5 x 1.0,0.6199,44.2,44.82,Expired,45.44,1.2399999999999949,2025-07-29,2025-08-28,22
TLT,Donchian Hook Buy,buy,07/29/25,Target Hit,09/19/25,ATR5 x 1.0,0.8997,86.77,87.67,Expired,87.805,1.0350000000000108,2025-07-29,2025-08-01,3
FXI,ETF Squeeze Sell,sell,07/29/25,Target Hit,09/19/25,ATR5 x 1.0,0.4278,37.97,37.54,Expired,39.435,-1.4650000000000034,2025-07-29,2025-07-31,2
EWH,ETF Squeeze Sell,sell,07/30/25,Target Hit,09/19/25,ATR5 x 1.0,0.2369,20.69,20.45,Expired,21.815,-1.125,2025-07-30,2025-08-01,2
USO,Weekly Turbo Hook Buy,buy,08/01/25,Target Hit,10/17/25,Weekly ATR5 x 0.55,2.6239,75.64,78.26,Expired,70.405,-5.234999999999999,2025-08-04,2025-09-26,38
IYR,Weekly Swing Sell,sell,08/01/25,Target Hit,10/17/25,Weekly ATR5 x 0.55,1.5194,95.09,93.57,Expired,94.859,0.23100000000000875,2025-08-01,2025-10-13,50
VNQ,Weekly Swing Sell,sell,08/01/25,Expired,10/17/25,Weekly ATR5 x 0.55,1.4915,89.11,87.62,Expired,89.38,-0.269999999999996,2025-08-01,2025-10-17,54
XLB,Weekly Swing Sell,sell,08/01/25,Expired,10/17/25,Weekly ATR5 x 0.55,0.9891,43.61,42.62,Expired,43.535,0.07500000000000284,2025-08-04,2025-10-17,53
XOP,Weekly Swing Sell,sell,08/01/25,Expired,10/17/25,Weekly ATR5 x 0.55,3.8984,123.39,119.49,Expired,134.36,-10.970000000000013,2025-08-01,2025-10-17,54
XLB,Weekly Ichimoku Squeeze Sell,sell,08/01/25,Expired,10/17/25,ATR20 x 1.0,0.6382,43.61,42.97,Expired,43.535,0.07500000000000284,2025-08-04,2025-10-17,53
XLF,Weekly Ichimoku Squeeze Sell,sell,08/01/25,Expired,10/17/25,ATR20 x 1.0,0.6445,51.6,50.96,Expired,53.48,-1.8799999999999955,2025-08-01,2025-10-17,54
XRT,Weekly Ichimoku Squeeze Sell,sell,08/01/25,Expired,10/17/25,ATR20 x 1.0,1.3957,78.36,76.95,Expired,86.09,-7.730000000000004,2025-08-04,2025-10-17,53
TLT,Donchian Crossover Buy,buy,08/05/25,Target Hit,10/17/25,ATR5 x 1.0,0.7587,87.84,88.6,Expired,87.805,-0.03499999999999659,2025-08-05,2025-09-05,22
XHB,Donchian T-Lines Buy/Sell,buy,08/05/25,Target Hit,10/17/25,ATR5 x 1.0,2.2716,107.85,110.12,Expired,105.75,-2.0999999999999943,2025-08-05,2025-08-12,5
SPY,Squeeze Play Sector Sell,sell,08/07/25,Expired,10/17/25,ATR5 x 1.0,6.8777,634.06,627.18,Expired,682.55,-48.49000000000001,2025-08-07,2025-10-17,50
XLI,Squeeze Play Sector Sell,sell,08/07/25,Target Hit,10/17/25,ATR5 x 1.0,1.8994,151.15,149.25,Expired,154.368,-3.2179999999999893,2025-08-07,2025-09-03,18
EFA,Donchian T-Lines Buy/Sell,buy,08/08/25,Target Hit,10/17/25,ATR5 x 1.0,0.8581,90.12,90.98,Expired,95.47,5.349999999999994,2025-08-08,2025-08-12,2
SPY,Donchian T-Lines Buy/Sell,buy,08/08/25,Target Hit,10/17/25,ATR5 x 1.0,6.5812,637.46,644.04,Expired,682.55,45.08999999999992,2025-08-08,2025-08-13,3
XME,Donchian T-Lines Buy/Sell,buy,08/08/25,Target Hit,10/17/25,ATR5 x 1.0,2.0486,78.7,80.75,Expired,98.33,19.629999999999995,2025-08-08,2025-08-12,2
EEM,Weekly Turbo Hook Buy,buy,08/08/25,Target Hit,10/17/25,Weekly ATR5 x 0.55,0.7148,49.4,50.11,Expired,54.622296,5.222296,2025-08-08,2025-08-13,3
EFA,Weekly Turbo Hook Buy,buy,08/08/25,Target Hit,10/17/25,Weekly ATR5 x 0.55,1.4742,90.12,91.59,Expired,95.47,5.349999999999994,2025-08-08,2025-08-13,3
DIA,20.8 Trigger Lines Put/Call Buy (Setup 5),buy,08/14/25,Target Hit,10/17/25,ATR5 x 1.0,4.2355,451.9,456.14,Expired,477.66,25.760000000000048,2025-08-14,2025-08-22,6
XLI,20.8 Trigger Lines Put/Call Buy (Setup 5),buy,08/14/25,Target Hit,10/17/25,ATR5 x 1.0,1.6575,150.98,152.64,Expired,154.368,3.3880000000000052,2025-08-14,2025-08-22,6
DIA,Donchian T-Lines Buy/Sell,buy,08/14/25,Target Hit,10/17/25,ATR5 x 1.0,4.2355,451.9,456.14,Expired,477.66,25.760000000000048,2025-08-14,2025-08-22,6
XLV,Donchian Hook Buy,buy,08/15/25,Target Hit,10/17/25,ATR5 x 1.0,1.9165,136.53,138.45,Expired,151.52,14.990000000000009,2025-08-15,2025-08-21,4
DIA,Weekly Turbo Hook Buy,buy,08/15/25,Target Hit,10/17/25,Weekly ATR5 x 0.55,6.3194,449.35,455.67,Expired,477.66,28.310000000000002,2025-08-15,2025-08-22,5
XRT,Weekly Swing Trend Buy,buy,08/15/25,Target Hit,10/17/25,Weekly ATR5 x 0.55,2.243,83.55,85.79,Expired,86.09,2.5400000000000063,2025-08-15,2025-08-22,5
XLI,Weekly Ichimoku Squeeze Sell,sell,08/15/25,Expired,10/17/25,ATR20 x 1.0,1.6886,150.45,148.76,Expired,154.368,-3.9180000000000064,2025-08-15,2025-10-17,44
XLB,Donchian T-Lines Buy/Sell,buy,08/18/25,Target Hit,10/17/25,ATR5 x 1.0,0.5654,44.79,45.36,Expired,43.535,-1.2550000000000026,2025-08-18,2025-08-22,4
XHB,ETF Squeeze Sell,sell,08/18/25,Target Hit,10/17/25,ATR5 x 1.0,2.4918,113.76,111.27,Expired,105.75,8.010000000000005,2025-08-18,2025-08-21,3
XLF,Donchian T-Lines Buy/Sell,buy,08/19/25,Target Hit,10/17/25,ATR5 x 1.0,0.5188,52.64,53.16,Expired,53.48,0.8399999999999963,2025-08-19,2025-08-22,3
QQQ,ETF Squeeze Sell,sell,08/19/25,Target Hit,10/17/25,ATR5 x 1.0,5.8228,568.33,562.51,Expired,622.48,-54.14999999999998,2025-08-19,2025-08-20,1
SPY,ETF Squeeze Sell,sell,08/19/25,Target Hit,10/17/25,ATR5 x 1.0,4.5564,639.4,634.84,Expired,682.55,-43.14999999999998,2025-08-19,2025-08-20,1
XME,ETF Squeeze Sell,sell,08/19/25,Expired,10/17/25,ATR5 x 1.0,1.7823,77.14,75.36,Expired,98.33,-21.189999999999998,2025-08-19,2025-10-17,42
SLV,Donchian T-Lines Buy/Sell,buy,08/20/25,Target Hit,10/17/25,ATR5 x 1.0,0.5107,34.48,34.99,Expired,52.6699,18.1899,2025-08-20,2025-08-22,2
IYR,Donchian Hook Buy,buy,08/20/25,Target Hit,10/17/25,ATR5 x 1.0,1.1775,95.82,97.0,Expired,94.859,-0.9609999999999985,2025-08-20,2025-08-22,2
SLV,Donchian Hook Buy,buy,08/20/25,Target Hit,10/17/25,ATR5 x 1.0,0.5107,34.48,34.99,Expired,52.6699,18.1899,2025-08-20,2025-08-22,2
IYR,Donchian T-Lines Buy/Sell,buy,08/21/25,Target Hit,10/17/25,ATR5 x 1.0,1.096,96.7,97.8,Expired,94.859,-1.8410000000000082,2025-08-21,2025-08-22,1
XLB,Donchian Hook Buy,buy,08/21/25,Target Hit,10/17/25,ATR5 x 1.0,0.5167,45.385,45.9,Expired,43.535,-1.8500000000000014,2025-08-21,2025-08-22,1
XLF,Donchian Hook Buy,buy,08/21/25,Target Hit,10/17/25,ATR5 x 1.0,0.5168,52.97,53.49,Expired,53.48,0.509999999999998,2025-08-21,2025-08-22,1
XLI,Donchian Hook Buy,buy,08/21/25,Target Hit,10/17/25,ATR5 x 1.0,1.3107,151.5,152.81,Expired,154.368,2.867999999999995,2025-08-21,2025-08-22,1
XHB,ETF Squeeze Sell,sell,08/21/25,Target Hit,10/17/25,ATR5 x 1.0,2.4893,112.42,109.93,Expired,105.75,6.670000000000002,2025-08-21,2025-09-25,24
XLE,Donchian T-Lines Buy/Sell,buy,08/22/25,Target Hit,10/17/25,ATR5 x 1.0,0.665,43.96,44.62,Expired,45.44,1.4799999999999969,2025-08-22,2025-08-27,3
XLI,Donchian T-Lines Buy/Sell,buy,08/22/25,Target Hit,10/17/25,ATR5 x 1.0,1.7515,152.88,154.63,Expired,154.368,1.4879999999999995,2025-08-22,2025-10-02,28
XOP,Donchian T-Lines Buy/Sell,buy,08/22/25,Target Hit,10/17/25,ATR5 x 1.0,2.7151,128.44,131.16,Expired,134.36,5.920000000000016,2025-08-22,2025-08-27,3
XLE,Donchian Hook Buy,buy,08/22/25,Target Hit,10/17/25,ATR5 x 1.0,0.665,43.96,44.62,Expired,45.44,1.4799999999999969,2025-08-22,2025-08-27,3
XOP,Donchian Hook Buy,buy,08/22/25,Target Hit,10/17/25,ATR5 x 1.0,2.7151,128.44,131.16,Expired,134.36,5.920000000000016,2025-08-22,2025-08-27,3
IBB,ETF Squeeze Sell,sell,08/25/25,Expired,10/17/25,ATR5 x 1.0,2.3405,137.39,135.05,Expired,170.04,-32.650000000000006,2025-08-25,2025-10-17,38
QQQ,Donchian T-Lines Buy/Sell,buy,08/26/25,Target Hit,10/17/25,ATR5 x 1.0,6.184,571.59,577.77,Expired,622.48,50.889999999999986,2025-08-26,2025-08-28,2
USO,Donchian T-Lines Buy/Sell,buy,08/27/25,Target Hit,10/17/25,ATR5 x 1.0,1.3492,74.94,76.29,Expired,70.405,-4.534999999999997,2025-08-27,2025-09-02,3
FXI,ETF Squeeze Sell,sell,08/27/25,Expired,10/17/25,ATR5 x 1.0,0.602,38.21,37.61,Expired,39.435,-1.2250000000000014,2025-08-27,2025-10-17,36
VWO,ETF Squeeze Sell,sell,08/27/25,Target Hit,10/17/25,ATR5 x 1.0,0.45,51.46,51.01,Expired,54.205,-2.7449999999999974,2025-08-27,2025-09-02,3
XHB,ETF Squeeze Sell,sell,08/27/25,Target Hit,10/17/25,ATR5 x 1.0,2.3415,115.46,113.12,Expired,105.75,9.709999999999994,2025-08-27,2025-09-02,3
XLV,Donchian Crossover Buy,buy,08/28/25,Target Hit,10/17/25,ATR5 x 1.0,1.4453,136.535,137.98,Expired,151.52,14.985000000000014,2025-08-28,2025-09-05,5
XLK,Donchian T-Lines Buy/Sell,buy,08/28/25,Target Hit,10/17/25,ATR5 x 1.0,1.6562,132.685,134.34,Expired,147.16,14.474999999999994,2025-08-28,2025-09-10,8
IBB,ETF Squeeze Sell,sell,08/28/25,Expired,10/17/25,ATR5 x 1.0,1.7789,138.13,136.35,Expired,170.04,-31.909999999999997,2025-08-28,2025-10-17,35
XLV,ETF Squeeze Sell,sell,08/28/25,Target Hit,10/17/25,ATR5 x 1.0,1.4453,136.535,135.09,Expired,151.52,-14.985000000000014,2025-08-28,2025-09-25,19
XRT,ETF Squeeze Sell,sell,08/28/25,Target Hit,10/17/25,ATR5 x 1.0,1.5381,85.64,84.1,Expired,86.09,-0.45000000000000284,2025-08-28,2025-09-02,2
QQQ,Squeeze Play Sector Sell,sell,08/29/25,Expired,10/17/25,ATR5 x 1.0,6.2771,561.31,555.03,Expired,622.48,-61.17000000000007,2025-08-29,2025-10-17,34
XLK,Squeeze Play Sector Sell,sell,08/29/25,Expired,10/17/25,ATR5 x 1.0,1.83,128.905,127.08,Expired,147.16,-18.254999999999995,2025-08-29,2025-10-17,34
IWM,ETF Squeeze Sell,sell,08/29/25,Expired,10/17/25,ATR5 x 1.0,3.0104,231.99,228.98,Expired,251.1,-19.109999999999985,2025-08-29,2025-10-17,34
XLK,Weekly Turbo Hook Buy,buy,08/29/25,Target Hit,10/17/25,Weekly ATR5 x 0.55,2.3383,128.905,131.24,Expired,147.16,18.254999999999995,2025-09-02,2025-09-04,2
GLD,Weekly Swing Trend Buy,buy,09/05/25,Target Hit,11/21/25,Weekly ATR5 x 0.55,4.874,333.66,338.53,Expired,385.27,51.60999999999996,2025-09-05,2025-09-15,6
XOP,Weekly Swing Sell,sell,09/05/25,Target Hit,11/21/25,Weekly ATR5 x 0.55,3.4485,130.56,127.11,Expired,134.36,-3.8000000000000114,2025-09-05,2025-10-10,25
VNQ,ETF Squeeze Sell,sell,09/08/25,Target Hit,11/21/25,ATR5 x 1.0,1.103,91.67,90.57,Expired,89.38,2.2900000000000063,2025-09-08,2025-09-24,12
QQQ,Donchian T-Lines Buy/Sell,buy,09/09/25,Target Hit,11/21/25,ATR5 x 1.0,6.3008,583.74,590.04,Expired,622.48,38.74000000000001,2025-09-09,2025-09-15,4
XHB,ETF Squeeze Sell,sell,09/09/25,Target Hit,11/21/25,ATR5 x 1.0,2.7899,116.48,113.69,Expired,105.75,10.730000000000004,2025-09-09,2025-09-17,6
FXI,ETF Squeeze Sell,sell,09/10/25,Target Hit,11/21/25,ATR5 x 1.0,0.5639,40.14,39.58,Expired,39.435,0.7049999999999983,2025-09-10,2025-10-10,22
EFA,Donchian T-Lines Buy/Sell,buy,09/11/25,Target Hit,11/21/25,ATR5 x 1.0,0.7812,92.99,93.77,Expired,95.47,2.480000000000004,2025-09-11,2025-09-17,4
XLB,Donchian T-Lines Buy/Sell,buy,09/11/25,Expired,11/21/25,ATR5 x 1.0,0.6769,46.065,46.74,Expired,43.535,-2.530000000000001,2025-09-11,2025-11-21,51
XLK,Weekly Turbo Hook Buy,buy,09/12/25,Target Hit,11/21/25,Weekly ATR5 x 0.55,2.4057,135.655,138.06,Expired,147.16,11.504999999999995,2025-09-12,2025-09-18,4
EWH,Squeeze Play Sector Sell,sell,09/16/25,Target Hit,11/21/25,ATR5 x 1.0,0.2242,21.87,21.65,Expired,21.815,0.054999999999999716,2025-09-16,2025-09-18,2
SLV,Squeeze Play Sector Sell	Sell	Daily,sell,09/17/25,Expired,11/21/25,ATR5 x 1.0,0.7261,37.855,37.13,Expired,52.6699,-14.814900000000002,2025-09-17,2025-11-21,47
XME,Squeeze Play Sector Sell,sell,09/17/25,Expired,11/21/25,ATR5 x 1.0,2.1438,87.73,85.59,Expired,98.33,-10.599999999999994,2025-09-17,2025-11-21,47
XLK,Gap and Go Put/Call Buy (Setup 6),buy,09/18/25,Target Hit,11/21/25,ATR5 x 1.0,1.7941,138.615,140.41,Expired,147.16,8.544999999999987,2025-09-18,2025-09-22,2
QQQ,Gap and Go Put/Call Buy (Setup 6),buy,09/18/25,Target Hit,11/21/25,ATR5 x 1.0,5.8169,597.33,603.15,Expired,622.48,25.149999999999977,2025-09-18,2025-10-01,9
XLI,Squeeze Play Sector Sell,sell,09/18/25,Target Hit,11/21/25,ATR5 x 1.0,1.797,153.25,151.45,Expired,154.368,-1.117999999999995,2025-09-18,2025-09-25,5
TLT,Squeeze Play Sector Sell,sell,09/18/25,Expired,11/21/25,ATR5 x 1.0,0.9006,89.07,88.17,Expired,87.805,1.2649999999999864,2025-09-18,2025-11-21,46
XLI,Donchian Hook Buy,buy,09/19/25,Target Hit,11/21/25,ATR5 x 1.0,1.7476,152.0,153.75,Expired,154.368,2.367999999999995,2025-09-19,2025-09-23,2
FXI,ETF Squeeze Sell,sell,09/19/25,Target Hit,11/21/25,ATR5 x 1.0,0.5758,40.7,40.12,Expired,39.435,1.2650000000000006,2025-09-19,2025-09-23,2
VWO,ETF Squeeze Sell,sell,09/19/25,Target Hit,11/21/25,ATR5 x 1.0,0.4615,53.94,53.48,Expired,54.205,-0.26500000000000057,2025-09-19,2025-09-26,5
USO,Ichimoku Kijun 5 Hook Buy,buy,09/19/25,Target Hit,11/21/25,ATR5 x 1.0,1.4115,72.8,74.21,Expired,70.405,-2.394999999999996,2025-09-19,2025-09-23,2
IYR,Weekly Swing Sell,sell,09/19/25,Target Hit,11/21/25,Weekly ATR5 x 0.55,1.3101,95.95,94.64,Expired,94.859,1.0910000000000082,2025-09-19,2025-10-09,14
XHB,Weekly Ichimoku Squeeze Sell,sell,09/19/25,Target Hit,11/21/25,ATR20 x 1.0,2.5934,112.36,109.77,Expired,105.75,6.609999999999999,2025-09-19,2025-09-25,4
XLI,Donchian Crossover Buy,buy,09/23/25,Target Hit,11/21/25,ATR5 x 1.0,1.7325,153.37,155.1,Expired,154.368,0.9979999999999905,2025-09-23,2025-10-03,8
XOP,Donchian T-Lines Buy/Sell,buy,09/24/25,Target Hit,11/21/25,ATR5 x 1.0,3.515,134.59,138.11,Expired,134.36,-0.22999999999998977,2025-09-24,2025-09-26,2
SPY,ETF Squeeze Sell,sell,09/24/25,Target Hit,11/21/25,ATR5 x 1.0,4.9384,657.94,653.0,Expired,682.55,-24.6099999999999,2025-09-24,2025-10-10,12
VWO,ETF Squeeze Sell,sell,09/24/25,Target Hit,11/21/25,ATR5 x 1.0,0.3632,53.63,53.27,Expired,54.205,-0.5749999999999957,2025-09-24,2025-09-26,2
XME,ETF Squeeze Sell,sell,09/24/25,Target Hit,11/21/25,ATR5 x 1.0,2.0602,89.47,87.41,Expired,98.33,-8.86,2025-09-24,2025-11-20,41
XLE,Donchian T-Lines Buy/Sell,buy,09/25/25,Target Hit,11/21/25,ATR5 x 1.0,0.7923,45.65,46.44,Expired,45.44,-0.21000000000000085,2025-09-25,2025-09-26,1
QQQ,ETF Squeeze Sell,sell,09/25/25,Target Hit,11/21/25,ATR5 x 1.0,6.1029,594.35,588.25,Expired,622.48,-28.129999999999995,2025-09-25,2025-11-20,40
XLI,ETF Squeeze Sell,sell,09/25/25,Target Hit,11/21/25,ATR5 x 1.0,1.6734,152.06,150.39,Expired,154.368,-2.3079999999999927,2025-09-25,2025-10-10,11
DIA,Gap and Go Put/Call Buy (Setup 6),buy,09/26/25,Target Hit,11/21/25,ATR5 x 1.0,3.8628,463.76,467.62,Expired,477.66,13.900000000000034,2025-09-26,2025-10-03,5
QQQ,Gap and Go Put/Call Buy (Setup 6),buy,09/26/25,Target Hit,11/21/25,ATR5 x 1.0,5.9303,599.11,605.04,Expired,622.48,23.370000000000005,2025-09-26,2025-10-02,4
SPY,Gap and Go Put/Call Buy (Setup 6),buy,09/26/25,Target Hit,11/21/25,ATR5 x 1.0,5.1298,664.36,669.49,Expired,682.55,18.18999999999994,2025-09-26,2025-10-02,4
XLK,Gap and Go Put/Call Buy (Setup 6),buy,09/26/25,Target Hit,11/21/25,ATR5 x 1.0,1.8654,140.22,142.09,Expired,147.16,6.939999999999998,2025-09-26,2025-10-01,3
USO,ETF Squeeze Sell,sell,09/29/25,Target Hit,11/21/25,ATR5 x 1.0,1.7027,73.87,72.17,Expired,70.405,3.4650000000000034,2025-09-29,2025-10-02,3
SLV,ETF Squeeze Sell,sell,10/02/25,Target Hit,12/19/25,ATR5 x 1.0,1.1182,43.33,42.21,Expired,52.6699,-9.3399,2025-10-02,2025-10-27,17
IYR,Weekly Turbo Hook Buy,buy,10/03/25,Target Hit,12/19/25,Weekly ATR5 x 0.55,1.1552,97.14,98.3,Expired,94.859,-2.281000000000006,2025-10-03,2025-10-23,14
XLB,Weekly Turbo Hook Buy,buy,10/03/25,Open,12/19/25,Weekly ATR5 x 0.55,0.726,44.955,45.68,Active,43.535,-1.4200000000000017,2025-10-03,,open
IWM,ETF Squeeze Sell,sell,10/07/25,Target Hit,12/19/25,ATR5 x 1.0,3.3326,245.28,241.95,Expired,251.1,-5.819999999999993,2025-10-07,2025-10-10,3
SLV,ETF Squeeze Sell,sell,10/07/25,Target Hit,12/19/25,ATR5 x 1.0,1.0947,44.43,43.34,Expired,52.6699,-8.239899999999999,2025-10-07,2025-10-09,2
XLI,ETF Squeeze Sell,sell,10/07/25,Target Hit,12/19/25,ATR5 x 1.0,1.55,154.64,153.09,Expired,154.368,0.27199999999999136,2025-10-07,2025-10-09,2
XME,ETF Squeeze Sell,sell,10/07/25,Target Hit,12/19/25,ATR5 x 1.0,2.4386,100.5,98.06,Expired,98.33,2.1700000000000017,2025-10-07,2025-10-22,11
UNG,ETF Squeeze Sell,sell,10/09/25,Target Hit,12/19/25,ATR5 x 1.0,0.5216,12.46,11.94,Expired,15.155,-2.6949999999999985,2025-10-09,2025-10-13,2
TLT,Donchian T-Lines Buy/Sell,buy,10/10/25,Target Hit,12/19/25,ATR5 x 1.0,0.7523,90.28,91.03,Expired,87.805,-2.4749999999999943,2025-10-10,2025-10-15,3
IBB,ETF Squeeze Sell,sell,10/10/25,Open,12/19/25,ATR5 x 1.0,2.1785,149.88,147.7,Active,170.04,-20.159999999999997,2025-10-10,,open
IWM,ETF Squeeze Sell,sell,10/10/25,Target Hit,12/19/25,ATR5 x 1.0,4.4935,241.83,237.34,Expired,251.1,-9.269999999999982,2025-10-10,2025-11-07,20
XME,ETF Squeeze Sell,sell,10/10/25,Target Hit,12/19/25,ATR5 x 1.0,3.2427,105.89,102.65,Expired,98.33,7.560000000000002,2025-10-10,2025-10-17,5
XLE,Weekly Swing Sell,sell,10/10/25,Open,12/19/25,Weekly ATR5 x 0.55,1.0802,42.9325,41.85,Active,45.44,-2.5075000000000003,2025-10-10,,open
XLV,ETF Squeeze Sell,sell,10/13/25,Open,12/19/25,ATR5 x 1.0,1.7824,141.6,139.82,Active,151.52,-9.920000000000016,2025-10-13,,open
IWM,Donchian T-Lines Buy/Sell,buy,10/14/25,Open,12/19/25,ATR5 x 1.0,5.8183,250.36,256.18,Active,251.1,0.7399999999999807,2025-10-14,,open
DIA,Squeeze Play Sector Sell,sell,10/16/25,Open,12/19/25,ATR5 x 1.0,6.6267,459.3,452.67,Active,477.66,-18.360000000000014,2025-10-16,,open
QQQ,Squeeze Play Sector Sell,sell,10/16/25,Target Hit,12/19/25,ATR5 x 1.0,11.154,597.95,586.8,Expired,622.48,-24.529999999999973,2025-10-16,2025-11-20,25
SPY,Squeeze Play Sector Sell,sell,10/16/25,Open,12/19/25,ATR5 x 1.0,10.2197,659.5,649.28,Active,682.55,-23.049999999999955,2025-10-16,,open
XLI,Squeeze Play Sector Sell,sell,10/16/25,Target Hit,12/19/25,ATR5 x 1.0,2.7248,151.44,148.72,Expired,154.368,-2.9279999999999973,2025-10-16,2025-11-20,25
XME,ETF Squeeze Sell,sell,10/16/25,Target Hit,12/19/25,ATR5 x 1.0,4.6755,104.03,99.35,Expired,98.33,5.700000000000003,2025-10-16,2025-10-22,4
IYR,Donchian T-Lines Buy/Sell,buy,10/17/25,Target Hit,12/19/25,ATR5 x 1.0,1.1317,97.465,98.6,Expired,94.859,-2.6060000000000088,2025-10-17,2025-10-24,5
IWM,Squeeze Play Sector Sell,sell,10/17/25,Target Hit,12/19/25,ATR5 x 1.0,5.6094,246.62,241.01,Expired,251.1,-4.47999999999999,2025-10-17,2025-10-22,3
SLV,Squeeze Play Sector Sell,sell,10/17/25,Target Hit,12/19/25,ATR5 x 1.0,1.9018,47.76,45.86,Expired,52.6699,-4.9099,2025-10-17,2025-10-21,2
DIA,Weekly Turbo Hook Buy,buy,10/17/25,Target Hit,12/19/25,Weekly ATR5 x 0.55,5.8116,463.45,469.26,Expired,477.66,14.210000000000036,2025-10-17,2025-10-21,2
VWO,Weekly Turbo Hook Buy,buy,10/17/25,Target Hit,12/19/25,Weekly ATR5 x 0.55,0.9518,54.65,55.6,Expired,54.205,-0.4450000000000003,2025-10-17,2025-10-27,6
XLK,Donchian T-Lines Buy/Sell,buy,10/20/25,Target Hit,12/19/25,ATR5 x 1.0,2.7309,144.005,146.74,Expired,147.16,3.155000000000001,2025-10-20,2025-10-24,4
QQQ,Donchian T-Lines Buy/Sell,buy,10/20/25,Target Hit,12/19/25,ATR5 x 1.0,10.375,611.64,622.01,Expired,622.48,10.840000000000032,2025-10-20,2025-10-27,5
IYR,Donchian Hook Buy,buy,10/20/25,Open,12/19/25,ATR5 x 1.0,1.1113,97.85,98.96,Active,94.859,-2.9909999999999997,2025-10-20,,open
SPY,Donchian T-Lines Buy/Sell,buy,10/22/25,Target Hit,12/19/25,ATR5 x 1.0,8.1882,668.12,676.31,Expired,682.55,14.42999999999995,2025-10-22,2025-10-24,2
VNQ,Donchian Hook Buy,buy,10/22/25,Open,12/19/25,ATR5 x 1.0,0.9465,92.32,93.27,Active,89.38,-2.9399999999999977,2025-10-22,,open
XLI,Donchian T-Lines Buy/Sell,buy,10/24/25,Open,12/19/25,ATR5 x 1.0,2.1781,155.97,158.15,Active,154.368,-1.6020000000000039,2025-10-24,,open
IYR,Weekly Swing Trend Buy,buy,10/24/25,Open,12/19/25,Weekly ATR5 x 0.55,1.3507,98.31,99.66,Active,94.859,-3.4510000000000076,2025-10-24,,open
GDX,Weekly Ichimoku Squeeze Sell,sell,10/24/25,Open,12/19/25,ATR20 x 1.0,2.6348,70.145,67.51,Active,79.91,-9.765,2025-10-24,,open
XME,Weekly Ichimoku Squeeze Sell,sell,10/24/25,Target Hit,12/19/25,ATR20 x 1.0,3.4145,98.5,95.09,Expired,98.33,0.1700000000000017,2025-10-24,2025-10-30,4
IYR,ETF Squeeze Sell,sell,10/28/25,Target Hit,12/19/25,ATR5 x 1.0,1.1604,95.53,94.37,Expired,94.859,0.6710000000000065,2025-10-28,2025-10-29,1
IWM,ETF Squeeze Sell,sell,10/29/25,Target Hit,12/19/25,ATR5 x 1.0,4.5875,245.27,240.68,Expired,251.1,-5.829999999999984,2025-10-29,2025-11-06,6
XLV,Donchian T-Lines Buy/Sell,buy,11/03/25,Target Hit,01/16/26,ATR5 x 1.0,1.6075,143.77,145.38,Expired,151.52,7.75,2025-11-03,2025-11-04,1
QQQ,ETF Squeeze Sell,sell,11/04/25,Target Hit,01/16/26,ATR5 x 1.0,9.277,618.49,609.21,Expired,622.48,-3.990000000000009,2025-11-04,2025-11-07,3
SPY,ETF Squeeze Sell,sell,11/04/25,Target Hit,01/16/26,ATR5 x 1.0,7.0177,674.98,667.96,Expired,682.55,-7.569999999999936,2025-11-04,2025-11-07,3
VWO,ETF Squeeze Sell,sell,11/04/25,Target Hit,01/16/26,ATR5 x 1.0,0.5496,54.52,53.97,Expired,54.205,0.31500000000000483,2025-11-04,2025-11-07,3
XLI,ETF Squeeze Sell,sell,11/04/25,Target Hit,01/16/26,ATR5 x 1.0,2.035,152.21,150.17,Expired,154.368,-2.157999999999987,2025-11-04,2025-11-17,9
FXI,Donchian T-Lines Buy/Sell,sell,11/07/25,Target Hit,01/16/26,ATR5 x 1.0,0.6131,40.585,39.97,Expired,39.435,1.1499999999999986,2025-11-07,2025-11-14,5
XOP,Weekly 10.5 Squeeze Buy,buy,11/07/25,Target Hit,01/16/26,Weekly ATR5 x 0.55,3.73,130.55,134.28,Expired,134.36,3.8100000000000023,2025-11-07,2025-11-11,2
QQQ,Gap and Go Put/Call Buy (Setup 6),buy,11/10/25,Open,01/16/26,ATR5 x 1.0,11.4168,620.57,631.99,Active,622.48,1.9099999999999682,2025-11-10,,open
XLK,Gap and Go Put/Call Buy (Setup 6),buy,11/10/25,Open,01/16/26,ATR5 x 1.0,3.1969,146.79,149.99,Active,147.16,0.37000000000000455,2025-11-10,,open
XLE,Donchian Crossover Buy,buy,11/10/25,Target Hit,01/16/26,ATR5 x 1.0,0.7666,45.445,46.21,Expired,45.44,-0.005000000000002558,2025-11-10,2025-12-05,18
GDX,Donchian Hook Buy,buy,11/10/25,Target Hit,01/16/26,ATR5 x 1.0,2.7448,76.535,79.28,Expired,79.91,3.375,2025-11-10,2025-11-12,2
XLE,Ichimoku Kijun 5 Hook Buy,buy,11/10/25,Target Hit,01/16/26,ATR5 x 1.0,0.7666,45.445,46.21,Expired,45.44,-0.005000000000002558,2025-11-10,2025-12-05,18
QQQ,Squeeze Play Sector Sell,sell,11/12/25,Target Hit,01/16/26,ATR5 x 1.0,9.6304,617.54,607.91,Expired,622.48,-4.940000000000055,2025-11-12,2025-11-13,1
XLI,Squeeze Play Sector Sell,sell,11/12/25,Target Hit,01/16/26,ATR5 x 1.0,1.7808,154.32,152.54,Expired,154.368,-0.04800000000000182,2025-11-12,2025-11-13,1
GDX,Donchian T-Lines Buy/Sell,buy,11/12/25,Target Hit,01/16/26,ATR5 x 1.0,2.7908,79.49,82.28,Expired,79.91,0.4200000000000017,2025-11-12,2025-11-28,11
DIA,Squeeze Play Sector Sell,sell,11/13/25,Target Hit,01/16/26,ATR5 x 1.0,5.7884,471.38,465.59,Expired,477.66,-6.28000000000003,2025-11-13,2025-11-17,2
UNG,ETF Squeeze Sell,sell,11/14/25,Target Hit,01/16/26,ATR5 x 1.0,0.533,14.5,13.97,Expired,15.155,-0.6549999999999994,2025-11-14,2025-11-18,2
EFA,Weekly Turbo Hook Buy,buy,11/14/25,Target Hit,01/16/26,Weekly ATR5 x 0.55,1.1267,94.6,95.73,Expired,95.47,0.8700000000000045,2025-11-17,2025-12-04,12
GLD,Weekly Turbo Hook Buy,buy,11/14/25,Target Hit,01/16/26,Weekly ATR5 x 0.55,9.4251,374.035,383.46,Expired,385.27,11.234999999999957,2025-11-14,2025-11-26,8
XME,Weekly Turbo Hook Buy,buy,11/14/25,Target Hit,01/16/26,Weekly ATR5 x 0.55,4.0299,90.6,94.63,Expired,98.33,7.730000000000004,2025-11-14,2025-11-26,8
FXI,Donchian T-Lines Buy/Sell,sell,11/17/25,Target Hit,01/16/26,ATR5 x 1.0,0.5941,39.22,38.63,Expired,39.435,-0.2150000000000034,2025-11-17,2025-11-20,3
EWH,ETF Squeeze Sell,sell,11/17/25,Target Hit,01/16/26,ATR5 x 1.0,0.326,22.11,21.78,Expired,21.815,0.29499999999999815,2025-11-17,2025-11-20,3
IBB,ETF Squeeze Sell,sell,11/20/25,Open,01/16/26,ATR5 x 1.0,3.4437,164.38,160.94,Active,170.04,-5.659999999999997,2025-11-20,,open
XLE,Weekly Swing Trend Buy,buy,11/21/25,Target Hit,01/16/26,Weekly ATR5 x 0.55,0.946,44.66,45.61,Expired,45.44,0.7800000000000011,2025-11-21,2025-12-01,5
TLT,Donchian T-Lines Buy/Sell,buy,11/25/25,Open,01/16/26,ATR5 x 1.0,0.5661,90.15,90.72,Active,87.805,-2.344999999999999,2025-11-25,,open
TLT,Donchian Hook Buy,buy,11/25/25,Open,01/16/26,ATR5 x 1.0,0.5661,90.15,90.72,Active,87.805,-2.344999999999999,2025-11-25,,open
USO,Ichimoku Kijun 5 Hook Buy,buy,11/25/25,Target Hit,01/16/26,ATR5 x 1.0,1.7534,69.07,70.82,Expired,70.405,1.335000000000008,2025-11-25,2025-11-28,2
GDX,Donchian Crossover Buy,buy,11/26/25,Open,01/16/26,ATR5 x 1.0,3.1671,82.26,85.43,Active,79.91,-2.3500000000000085,2025-11-26,,open
IWM,Donchian T-Lines Buy/Sell,buy,11/26/25,Open,01/16/26,ATR5 x 1.0,5.5225,248.01,253.53,Active,251.1,3.0900000000000034,2025-11-26,,open
IWM,Donchian Hook Buy,buy,11/26/25,Open,01/16/26,ATR5 x 1.0,5.5225,248.01,253.53,Active,251.1,3.0900000000000034,2025-11-26,,open
SPY,20.8 Trigger Lines Put/Call Buy (Setup 5),buy,11/28/25,Open,01/16/26,ATR5 x 1.0,9.6321,678.81,688.44,Active,682.55,3.740000000000009,2025-11-28,,open
SPY,Donchian T-Lines Buy/Sell,buy,11/28/25,Open,01/16/26,ATR5 x 1.0,9.6321,678.81,688.44,Active,682.55,3.740000000000009,2025-11-28,,open
XLB,Ichimoku Kijun 5 Hook Buy,buy,11/28/25,Open,01/16/26,ATR5 x 1.0,0.6485,44.64,45.29,Active,43.535,-1.105000000000004,2025-11-28,,open
DIA,Weekly Turbo Hook Buy,buy,11/28/25,Target Hit,01/16/26,Weekly ATR5 x 0.55,7.1576,474.34,481.5,Expired,477.66,3.32000000000005,2025-12-01,2025-12-05,4
EEM,Weekly Turbo Hook Buy,buy,11/28/25,Target Hit,01/16/26,Weekly ATR5 x 0.55,0.9423,54.15,55.09,Expired,54.622296,0.47229600000000005,2025-11-28,2025-12-05,5
EFA,Weekly Turbo Hook Buy,buy,11/28/25,Open,01/16/26,Weekly ATR5 x 0.55,1.3943,94.92,96.31,Active,95.47,0.5499999999999972,2025-11-28,,open
GLD,Weekly Turbo Hook Buy,buy,11/28/25,Open,01/16/26,Weekly ATR5 x 0.55,8.5764,390.61,399.19,Active,385.27,-5.340000000000032,2025-11-28,,open
QQQ,Weekly Turbo Hook Buy,buy,11/28/25,Target Hit,01/16/26,Weekly ATR5 x 0.55,14.2025,613.63,627.83,Expired,622.48,8.850000000000023,2025-12-01,2025-12-05,4
SPY,Weekly Turbo Hook Buy,buy,11/28/25,Open,01/16/26,Weekly ATR5 x 0.55,11.0539,678.81,689.86,Active,682.55,3.740000000000009,2025-12-01,,open
VWO,Weekly Turbo Hook Buy,buy,11/28/25,Open,01/16/26,Weekly ATR5 x 0.55,0.8315,54.13,54.96,Active,54.205,0.07499999999999574,2025-11-28,,open
XLK,Weekly Turbo Hook Buy,buy,11/28/25,Target Hit,01/16/26,Weekly ATR5 x 0.55,4.0499,141.72,145.77,Expired,147.16,5.439999999999998,2025-12-01,2025-12-04,3
XME,Weekly Turbo Hook Buy,buy,11/28/25,Target Hit,01/16/26,Weekly ATR5 x 0.55,4.1959,96.56,100.76,Expired,98.33,1.769999999999996,2025-11-28,2025-12-04,4
XRT,Weekly Swing Trend Buy,buy,11/28/25,Target Hit,01/16/26,Weekly ATR5 x 0.55,2.2352,83.65,85.89,Expired,86.09,2.4399999999999977,2025-12-01,2025-12-03,2
XLB,Weekly 10.5 Squeeze Buy,buy,11/28/25,Open,01/16/26,Weekly ATR5 x 0.55,0.8252,44.64,45.47,Active,43.535,-1.105000000000004,2025-11-28,,open
DIA,Donchian T-Lines Buy/Sell,buy,12/01/25,Target Hit,02/20/26,ATR5 x 1.0,5.5648,474.21,479.77,Expired,477.66,3.4500000000000455,2025-12-01,2025-12-03,2
QQQ,Donchian T-Lines Buy/Sell,buy,12/01/25,Open,02/20/26,ATR5 x 1.0,10.9157,619.46,630.38,Active,622.48,3.019999999999982,2025-12-01,,open
XLE,Donchian T-Lines Buy/Sell,buy,12/01/25,Target Hit,02/20/26,ATR5 x 1.0,0.8131,45.59,46.4,Expired,45.44,-0.15000000000000568,2025-12-01,2025-12-05,4
XLV,ETF Squeeze Sell,sell,12/01/25,Target Hit,02/20/26,ATR5 x 1.0,2.1552,155.25,153.09,Expired,151.52,3.7299999999999898,2025-12-01,2025-12-05,4
XLK,Donchian T-Lines Buy/Sell,buy,12/02/25,Target Hit,02/20/26,ATR5 x 1.0,2.983,143.95,146.93,Expired,147.16,3.210000000000008,2025-12-02,2025-12-05,3
XLI,Ichimoku Tenkan Flat Put/Call Buy (Setup 3),buy,12/03/25,Open,02/20/26,ATR5 x 1.0,1.9976,154.29,156.29,Active,154.368,0.07800000000000296,2025-12-03,,open
XME,Donchian Hook Buy,buy,12/03/25,Target Hit,02/20/26,ATR5 x 1.0,2.7565,99.02,101.78,Expired,98.33,-0.6899999999999977,2025-12-03,2025-12-05,2
QQQ,Donchian Hook Buy,buy,12/04/25,Open,02/20/26,ATR5 x 1.0,8.5015,624.38,632.88,Active,622.48,-1.8999999999999773,2025-12-04,,open
SPY,Donchian Hook Buy,buy,12/04/25,Open,02/20/26,ATR5 x 1.0,6.6377,685.47,692.11,Active,682.55,-2.9200000000000728,2025-12-04,,open
XLF,Donchian Hook Buy,buy,12/04/25,Open,02/20/26,ATR5 x 1.0,0.6255,53.54,54.17,Active,53.48,-0.060000000000002274,2025-12-04,,open
XLI,Donchian Hook Buy,buy,12/04/25,Open,02/20/26,ATR5 x 1.0,1.8711,155.03,156.9,Active,154.368,-0.6620000000000061,2025-12-04,,open
IWM,Ichimoku Kijun 5 Hook Buy,buy,12/04/25,Open,02/20/26,ATR5 x 1.0,4.1603,251.485,255.65,Active,251.1,-0.3850000000000193,2025-12-04,,open
XLF,Ichimoku Kijun 5 Hook Buy,buy,12/04/25,Open,02/20/26,ATR5 x 1.0,0.6255,53.54,54.17,Active,53.48,-0.060000000000002274,2025-12-04,,open
DIA,Donchian Hook Buy,buy,12/05/25,Open,02/20/26,ATR5 x 1.0,4.4954,480.49,484.99,Active,477.66,-2.829999999999984,2025-12-05,,open
EFA,Donchian Hook Buy,buy,12/05/25,Open,02/20/26,ATR5 x 1.0,0.7129,95.82,96.53,Active,95.47,-0.3499999999999943,2025-12-05,,open
XLK,Donchian Hook Buy,buy,12/05/25,Open,02/20/26,ATR5 x 1.0,2.3293,147.43,149.76,Active,147.16,-0.27000000000001023,2025-12-05,,open
XRT,Ichimoku Kijun 5 Hook Buy,buy,12/05/25,Open,02/20/26,ATR5 x 1.0,1.7204,86.54,88.26,Active,86.09,-0.45000000000000284,2025-12-05,,open
